{
  "epoch": "3f9a1c7e5b2d4086",
  "messages": [
    {
      "id": "00000000-0000-4000-8000-0000000000a2",
      "seq": 3,
      "from": "alice",
      "to": "bob",
      "type": "text",
      "payload": {
        "text": "Queued by Alice while offline"
      },
      "created_at": "2026-10-13T15:00:03.000Z",
      "accepted_at": "2026-10-13T15:00:05.010Z"
    }
  ],
  "next_cursor": 3,
  "has_more": false
}
